{
  "tuple_type": "TRANSFORMATION_SELECTED",
  "id": "c8de0892-0c1",
  "time": "2026-04-17T23:42:12Z",
  "problem_id": "research-trace-001",
  "run_id": "run-ai-confirm-001",
  "control_mode": "AI_PROPOSE_HUMAN_CONFIRM",
  "tuple_data": {
    "transformation_id": "synthesis",
    "selected_by": "human:operator",
    "selection_rationale": "Confirmed AI proposal after reviewing ranked candidates.",
    "candidate_count": 4,
    "confidence": 0.9
  }
}
